{
  "$schema": "https://json-schema.org/draft/2020-12/schema",
  "$id": "https://github.com/stacknil/telemetry-lab/schemas/config_investigation_hits.schema.json",
  "title": "Config-change investigation hits",
  "description": "Schema for demos/config-change-investigation-demo/artifacts/investigation_hits.json.",
  "type": "array",
  "minItems": 1,
  "items": {
    "type": "object",
    "additionalProperties": false,
    "required": [
      "investigation_id",
      "severity",
      "rule_id",
      "target_system",
      "actor",
      "triggering_change",
      "trigger_reason",
      "correlation_window_minutes",
      "bounded_correlation_reason",
      "attached_policy_denials",
      "attached_follow_on_events",
      "evidence_counts"
    ],
    "properties": {
      "investigation_id": { "type": "string", "pattern": "^CCI-[0-9]{3}$" },
      "severity": { "type": "string", "enum": ["low", "medium", "high", "critical"] },
      "rule_id": { "type": "string", "minLength": 1 },
      "target_system": { "type": "string", "minLength": 1 },
      "actor": { "type": "string", "minLength": 1 },
      "triggering_change": { "$ref": "#/$defs/config_change" },
      "trigger_reason": { "type": "string", "minLength": 1 },
      "correlation_window_minutes": { "type": "integer", "minimum": 1 },
      "bounded_correlation_reason": { "type": "string", "minLength": 1 },
      "attached_policy_denials": {
        "type": "array",
        "items": { "$ref": "#/$defs/policy_denial" }
      },
      "attached_follow_on_events": {
        "type": "array",
        "items": { "$ref": "#/$defs/follow_on_event" }
      },
      "evidence_counts": {
        "type": "object",
        "additionalProperties": false,
        "required": ["policy_denials", "follow_on_events"],
        "properties": {
          "policy_denials": { "type": "integer", "minimum": 0 },
          "follow_on_events": { "type": "integer", "minimum": 0 }
        }
      }
    }
  },
  "$defs": {
    "config_change": {
      "type": "object",
      "additionalProperties": false,
      "required": [
        "change_id",
        "timestamp",
        "actor",
        "target_system",
        "config_key",
        "old_value",
        "new_value",
        "change_result",
        "change_ticket"
      ],
      "properties": {
        "change_id": { "type": "string", "minLength": 1 },
        "timestamp": { "type": "string", "format": "date-time" },
        "actor": { "type": "string", "minLength": 1 },
        "target_system": { "type": "string", "minLength": 1 },
        "config_key": { "type": "string", "minLength": 1 },
        "old_value": { "type": "string" },
        "new_value": { "type": "string" },
        "change_result": { "type": "string", "minLength": 1 },
        "change_ticket": { "type": "string", "minLength": 1 }
      }
    },
    "policy_denial": {
      "type": "object",
      "additionalProperties": false,
      "required": [
        "denial_id",
        "timestamp",
        "actor",
        "target_system",
        "policy_name",
        "decision",
        "reason"
      ],
      "properties": {
        "denial_id": { "type": "string", "minLength": 1 },
        "timestamp": { "type": "string", "format": "date-time" },
        "actor": { "type": "string", "minLength": 1 },
        "target_system": { "type": "string", "minLength": 1 },
        "policy_name": { "type": "string", "minLength": 1 },
        "decision": { "type": "string", "minLength": 1 },
        "reason": { "type": "string", "minLength": 1 }
      }
    },
    "follow_on_event": {
      "type": "object",
      "additionalProperties": false,
      "required": [
        "event_id",
        "timestamp",
        "target_system",
        "event_type",
        "details"
      ],
      "properties": {
        "event_id": { "type": "string", "minLength": 1 },
        "timestamp": { "type": "string", "format": "date-time" },
        "target_system": { "type": "string", "minLength": 1 },
        "event_type": { "type": "string", "minLength": 1 },
        "details": { "type": "string", "minLength": 1 }
      }
    }
  }
}
